{
  "schema_version": 1,
  "profile_id": "ai-prose-fatigue",
  "profile_kind": "fatigue",
  "version": "1.0.0",
  "reviewed_at": "2026-08-25",
  "review_after": "2027-02-25",
  "patterns": [
    {
      "id": "low-information-affirmation-cluster",
      "family": "low_information_affirmation",
      "rationale": "Repeated unsupported affirmation or significance language can make emphasis predictable while giving this audience little new evidence.",
      "observable_signals": [
        "Two or more evaluative clauses repeat the same importance claim without adding evidence or consequence.",
        "Several nearby intensifiers or affirmation frames can be removed without changing the proposition.",
        "A term such as real is repeated without marking a real-versus-simulated, hypothetical, apparent, or bogus distinction."
      ],
      "evidence_class": "plausible_emerging",
      "contextual_threshold": {
        "unit": "local_cluster",
        "minimum_count": 2,
        "minimum_distinct_signals": 2,
        "window_words": 80,
        "decision_rule": "Require recurrence plus an identified evidence or information gap; an isolated word or supported evaluation is not actionable."
      },
      "rules": [
        {
          "id": "affirmation-phrases",
          "kind": "normalized_phrase_occurrence",
          "phrases": ["truly important", "deeply meaningful", "meaningful shift", "important shift", "real opportunity", "game-changing", "transformative", "remarkable", "significant", "real"]
        }
      ],
      "preserve_predicates": [
        {"id": "real-simulated-distinction", "kind": "all_phrases", "scope": "text_and_context", "phrases": ["real", "simulated"]},
        {"id": "records-fixtures-distinction", "kind": "all_phrases", "scope": "text_and_context", "phrases": ["customer records", "generated fixtures"]}
      ],
      "preserve_conditions": [
        "The evaluation is supported by a named result, source, or consequence.",
        "The wording distinguishes real from simulated, hypothetical, apparent, or bogus states.",
        "Repetition is an intentional refrain with a clear rhetorical purpose."
      ],
      "repair_guidance": "Delete one redundant evaluator or replace it with the specific evidence, consequence, or distinction that earns the emphasis.",
      "source_ids": [
        "kobak-2025-excess-vocabulary",
        "miletic-falk-2026-scientific-communication"
      ],
      "scope": "Local clusters in supplied general or scholarly prose; evidence is strongest only in the registered scholarly domains.",
      "limitations": "The sources measure domain-level lexical change, not unsupported affirmation as a universal fatigue cause or a named word as a defect.",
      "version": "1.0.0",
      "status": "active",
      "first_observed": "2026-08-25",
      "reviewed_at": "2026-08-25",
      "review_after": "2027-02-25",
      "golden_case_ids": [
        "repair-affirmation-and-contrast-cluster",
        "preserve-precise-distinction-and-contrast",
        "abstain-without-audience-context"
      ]
    },
    {
      "id": "repeated-contrast-profundity",
      "family": "synthetic_profundity",
      "rationale": "Repeated contrast frames can simulate argumentative movement while restating the same broad claim, tiring readers who need a concrete distinction.",
      "observable_signals": [
        "Two or more nearby contrast frames restate rather than narrow or test the claim.",
        "Abstract oppositions appear without actors, evidence, conditions, or consequences.",
        "Removing one contrast leaves the argument unchanged."
      ],
      "evidence_class": "weak_or_folk_heuristic",
      "contextual_threshold": {
        "unit": "section",
        "minimum_count": 2,
        "minimum_distinct_signals": 2,
        "decision_rule": "Require repeated contrast plus semantic duplication and a reader need for a concrete distinction."
      },
      "rules": [
        {
          "id": "contrast-phrases",
          "kind": "normalized_phrase_occurrence",
          "phrases": ["not merely", "not just", "not only", "but rather", "more than", "not a", "but a"]
        }
      ],
      "preserve_predicates": [
        {"id": "real-simulated-distinction", "kind": "all_phrases", "scope": "text_and_context", "phrases": ["real", "simulated"]},
        {"id": "records-fixtures-distinction", "kind": "all_phrases", "scope": "text_and_context", "phrases": ["customer records", "generated fixtures"]}
      ],
      "preserve_conditions": [
        "The contrast distinguishes materially different states, choices, or evidence.",
        "The form carries deliberate cadence or emphasis without obscuring the claim.",
        "Parallel opposition makes a complex comparison easier to follow."
      ],
      "repair_guidance": "Keep the strongest contrast and replace the repeated frame with the actor, condition, evidence, or consequence that advances the argument.",
      "source_ids": [
        "miletic-falk-2026-scientific-communication"
      ],
      "scope": "A drafting hypothesis for repeated local contrast; no registered study isolates the device as a causal fatigue mechanism.",
      "limitations": "Contrast is ordinary human rhetoric, and the cited source does not establish a universal defect or threshold for it.",
      "version": "1.0.0",
      "status": "active",
      "first_observed": "2026-08-25",
      "reviewed_at": "2026-08-25",
      "review_after": "2027-02-25",
      "golden_case_ids": [
        "repair-affirmation-and-contrast-cluster",
        "preserve-precise-distinction-and-contrast",
        "abstain-without-audience-context"
      ]
    },
    {
      "id": "audience-cue-overload",
      "family": "manufactured_conversationality",
      "rationale": "Repeated questions, second-person nudges, or asides can make the reader perform a conversation that the task does not need.",
      "observable_signals": [
        "Several nearby rhetorical questions have predictable answers and do not structure a decision.",
        "Repeated direct-address cues interrupt rather than support the reader's task.",
        "Conversational asides add tone but no relationship, orientation, or information."
      ],
      "evidence_class": "weak_or_folk_heuristic",
      "contextual_threshold": {
        "unit": "section",
        "minimum_count": 3,
        "minimum_distinct_signals": 2,
        "decision_rule": "Require a visible cluster and a concrete mismatch with the declared audience, genre, or reader task."
      },
      "rules": [
        {
          "id": "audience-cue-phrases",
          "kind": "normalized_phrase_occurrence",
          "phrases": ["you might", "you can", "you'll", "ready to", "can you", "as you", "what changes"]
        }
      ],
      "preserve_predicates": [
        {"id": "teaching-context", "kind": "any_phrase", "scope": "context", "phrases": ["tutorial", "newcomer", "trust boundary"]}
      ],
      "preserve_conditions": [
        "Direct address supports an existing relationship or explicit product voice.",
        "A question structures reflection, teaching, accessibility, or a real decision.",
        "The audience expects an intentionally conversational genre."
      ],
      "repair_guidance": "Retain the audience cue that does useful work and convert only redundant cues into a direct claim or instruction.",
      "source_ids": [
        "miletic-falk-2026-scientific-communication"
      ],
      "scope": "Context-dependent prose review; the registered evidence does not directly measure conversational cue fatigue.",
      "limitations": "Questions and direct address are legitimate devices, and no source supports a universal density limit.",
      "version": "1.0.0",
      "status": "active",
      "first_observed": "2026-08-25",
      "reviewed_at": "2026-08-25",
      "review_after": "2027-02-25",
      "golden_case_ids": [
        "repair-conversation-and-preface-cluster",
        "preserve-teaching-question-and-signpost",
        "abstain-without-audience-context"
      ]
    },
    {
      "id": "editorial-preface-density",
      "family": "editorial_throat_clearing",
      "rationale": "Repeated editorial prefaces can delay the claim or evidence for readers who need a decision or instruction quickly.",
      "observable_signals": [
        "Multiple sentences open with meta-commentary about noting, considering, or remembering the point.",
        "The preface can be removed without changing scope, uncertainty, attribution, or relationship.",
        "The actual claim repeatedly arrives after low-information orientation."
      ],
      "evidence_class": "weak_or_folk_heuristic",
      "contextual_threshold": {
        "unit": "section",
        "minimum_count": 2,
        "minimum_distinct_signals": 2,
        "decision_rule": "Require repeated delay plus an audience need for earlier claims; preserve necessary orientation and qualification."
      },
      "rules": [
        {
          "id": "editorial-preface-phrases",
          "kind": "normalized_phrase_occurrence",
          "phrases": ["it is worth noting", "it is important to remember", "it's worth noting", "let's be clear", "at its core", "the key thing is", "it is worth pausing"]
        }
      ],
      "preserve_predicates": [
        {"id": "orientation-context", "kind": "any_phrase", "scope": "context", "phrases": ["tutorial", "newcomer", "trust boundary"]}
      ],
      "preserve_conditions": [
        "The preface marks attribution, uncertainty, legal scope, or a change in reasoning.",
        "A long or technical document needs reader orientation or recap.",
        "The phrase maintains a deliberate relationship or register."
      ],
      "repair_guidance": "Move the claim or evidence to the start and retain only the qualification or transition that changes its meaning.",
      "source_ids": [
        "miletic-falk-2026-scientific-communication"
      ],